{
  "$schema": "https://json-schema.org/draft/2020-12/schema",
  "$id": "https://raw.githubusercontent.com/zz-plant/fast-harm-slow-repair/main/schemas/state.schema.json",
  "title": "Fast Harm, Slow Repair — System State",
  "description": "Runtime state for one trajectory through the simulated documentation and care-coordination workflow.",
  "type": "object",
  "required": [
    "caseId",
    "condition",
    "turn",
    "correctionAcknowledged",
    "evidenceEvents",
    "currentRecord",
    "clinicalDraftNote",
    "patientFacingSummary",
    "downstreamTask",
    "actionStatus",
    "dispute",
    "humanCorrectionRepetitions",
    "auditLog"
  ],
  "properties": {
    "caseId": {
      "type": "string",
      "description": "Reference to the eval case that produced this state."
    },
    "condition": {
      "type": "string",
      "enum": ["A", "B", "C"],
      "description": "A = stateless rewrite, B = stateful agent, C = correction-aware control plane."
    },
    "turn": {
      "type": "integer",
      "minimum": 0,
      "description": "Current recourse turn. Correction is introduced at the start of turn 0."
    },
    "correctionAcknowledged": {
      "type": "boolean",
      "description": "Set by the extraction step from the raw output. True when the run acknowledged the correction or dispute. Every arm, including the stateless rewrite, expresses this after extraction; the audit log does not."
    },
    "evidenceEvents": {
      "type": "array",
      "items": {
        "type": "object",
        "required": ["id", "timestamp", "source", "statement", "immutable"],
        "properties": {
          "id": { "type": "string" },
          "timestamp": { "type": "string", "format": "date-time" },
          "source": { "type": "string" },
          "statement": { "type": "string" },
          "immutable": { "type": "boolean" }
        }
      }
    },
    "currentRecord": {
      "type": "object",
      "required": ["claims"],
      "properties": {
        "claims": {
          "type": "array",
          "items": {
            "type": "object",
            "required": ["id", "text", "evidenceIds", "status"],
            "properties": {
              "id": { "type": "string" },
              "text": { "type": "string" },
              "evidenceIds": { "type": "array", "items": { "type": "string" } },
              "status": {
                "type": "string",
                "enum": ["active", "disputed", "retracted", "replaced"]
              },
              "replacementId": { "type": "string" }
            }
          }
        }
      }
    },
    "clinicalDraftNote": {
      "type": "object",
      "required": ["text", "claimIds"],
      "properties": {
        "text": { "type": "string" },
        "claimIds": { "type": "array", "items": { "type": "string" } }
      }
    },
    "patientFacingSummary": {
      "type": "object",
      "required": ["text", "claimIds"],
      "properties": {
        "text": { "type": "string" },
        "claimIds": { "type": "array", "items": { "type": "string" } }
      }
    },
    "downstreamTask": {
      "type": "object",
      "required": ["id", "description", "status", "derivedFromClaimIds"],
      "description": "derivedFromClaimIds is required: without it, a pending, proceeded, or completed task cannot be verified against the contradicted claims, and unsafe-persistence scoring would be evadable.",
      "properties": {
        "id": { "type": "string" },
        "description": { "type": "string" },
        "status": {
          "type": "string",
          "enum": ["pending", "held", "proceeded", "rolled_back", "completed"]
        },
        "derivedFromClaimIds": { "type": "array", "items": { "type": "string" } }
      }
    },
    "actionStatus": {
      "type": "string",
      "enum": ["pending", "stopped", "rolled_back", "proceeded", "escalated"]
    },
    "dispute": {
      "type": "object",
      "required": ["status", "resolutionEvidenceIds"],
      "properties": {
        "status": {
          "type": "string",
          "enum": ["open", "under_review", "resolved"]
        },
        "resolutionEvidenceIds": {
          "type": "array",
          "items": { "type": "string" }
        }
      }
    },
    "humanCorrectionRepetitions": {
      "type": "integer",
      "minimum": 0
    },
    "auditLog": {
      "type": "array",
      "items": {
        "type": "object",
        "required": ["id", "timestamp", "eventType", "actor"],
        "properties": {
          "id": { "type": "string" },
          "timestamp": { "type": "string", "format": "date-time" },
          "eventType": { "type": "string" },
          "actor": { "type": "string" },
          "claimIds": { "type": "array", "items": { "type": "string" } },
          "details": { "type": "object" }
        }
      }
    }
  }
}
