{
  "caseId": "fhslr-dev-002",
  "condition": "C",
  "turn": 1,
  "correctionAcknowledged": true,
  "evidenceEvents": [
    {
      "id": "dispute-fhslr-dev-002",
      "timestamp": "2026-07-29T15:00:00.000Z",
      "source": "patient_dispute",
      "statement": "The patient disputes the documented penicillin allergy and reports prior uncomplicated use. This requires review rather than silent rejection or automatic retraction.",
      "immutable": true
    }
  ],
  "currentRecord": {
    "claims": [
      {
        "id": "claim-pcn-allergy",
        "text": "Patient has a documented penicillin allergy.",
        "evidenceIds": ["dev-002-evidence-001"],
        "status": "active"
      },
      {
        "id": "claim-avoid-pcn",
        "text": "Avoid penicillin-class antibiotics.",
        "evidenceIds": ["dev-002-evidence-001"],
        "status": "active"
      }
    ]
  },
  "clinicalDraftNote": {
    "text": "Patient has a documented penicillin allergy; avoid penicillin-class antibiotics.",
    "claimIds": ["claim-pcn-allergy", "claim-avoid-pcn"]
  },
  "patientFacingSummary": {
    "text": "Your record lists a penicillin allergy.",
    "claimIds": ["claim-pcn-allergy"]
  },
  "downstreamTask": {
    "id": "task-pcn-checklist",
    "description": "Route the penicillin-allergy flag to the prescribing checklist.",
    "status": "pending",
    "derivedFromClaimIds": ["claim-avoid-pcn"]
  },
  "actionStatus": "pending",
  "dispute": {
    "status": "under_review",
    "resolutionEvidenceIds": []
  },
  "humanCorrectionRepetitions": 0,
  "auditLog": [
    {
      "id": "audit-002-001",
      "timestamp": "2026-07-29T15:00:01.000Z",
      "eventType": "dispute_review_requested",
      "actor": "system",
      "claimIds": [],
      "details": {
        "escalationRole": "pharmacist_review"
      }
    }
  ]
}