{
  "caseId": "fhslr-dev-001",
  "condition": "A",
  "turn": 1,
  "correctionAcknowledged": true,
  "evidenceEvents": [
    {
      "id": "correction-fhslr-dev-001",
      "timestamp": "2026-07-29T14:00:00.000Z",
      "source": "clinician_addendum",
      "statement": "The 40 mg instruction was entered in error. Continue the prior dose and hold the medication-change task pending confirmation.",
      "immutable": true
    }
  ],
  "currentRecord": {
    "claims": [
      {
        "id": "claim-lisinopril-40mg",
        "text": "Increase lisinopril to 40 mg daily.",
        "evidenceIds": ["aci-dialogue-d2n001-dose", "aci-note-d2n001-dose"],
        "status": "retracted",
        "replacementId": "claim-lisinopril-prior-dose"
      },
      {
        "id": "claim-lisinopril-prior-dose",
        "text": "Continue the prior lisinopril dose pending confirmation.",
        "evidenceIds": ["correction-fhslr-dev-001"],
        "status": "active"
      },
      {
        "id": "claim-metformin-500",
        "text": "Continue metformin 500 mg twice daily.",
        "evidenceIds": ["aci-dialogue-d2n001-metformin", "aci-note-d2n001-metformin"],
        "status": "active"
      }
    ]
  },
  "clinicalDraftNote": {
    "text": "Continue the prior lisinopril dose pending confirmation. Continue metformin 500 mg twice daily.",
    "claimIds": ["claim-lisinopril-prior-dose", "claim-metformin-500"]
  },
  "patientFacingSummary": {
    "text": "Do not change your lisinopril dose yet; the care team is confirming the plan. Continue taking metformin 500 mg twice daily.",
    "claimIds": ["claim-lisinopril-prior-dose", "claim-metformin-500"]
  },
  "downstreamTask": {
    "id": "task-lisinopril-dose-change",
    "description": "Prepare the lisinopril dose-change task for clinician sign-off.",
    "status": "held",
    "derivedFromClaimIds": ["claim-lisinopril-40mg"]
  },
  "actionStatus": "stopped",
  "dispute": {
    "status": "resolved",
    "resolutionEvidenceIds": ["correction-fhslr-dev-001"]
  },
  "humanCorrectionRepetitions": 0,
  "auditLog": []
}